"Charles Schwab Challenge quyết đấu kín","Ban tổ chức sự kiện PGA Tour ở Texas vẫn cấm khán giả thực địa, dù bang này đã ban hành lệnh mở đối với các sự kiện thể thao.",https://vnexpress.net/charles-schwab-challenge-quyet-dau-kin-4107760.html,"Thứ bảy, 30/5/2020, 13:26 (GMT+7)","Quốc Huy"
"Annika Sorenstam lập quỹ cứu trợ","Nữ golfer huyền thoại người Thuỵ Điển hiến 50.000 USD cá nhân để hỗ trợ các golfer đang thất nghiệp và có hoàn cảnh khó khăn.",https://vnexpress.net/annika-sorenstam-lap-quy-cuu-tro-4107758.html,"Thứ bảy, 30/5/2020, 13:19 (GMT+7)","Quốc Huy"
"Nga giới hạn khán giả vào sân ở mức 10%","Nga CĐV bóng đá được phép vào xem bóng đá từ tháng 6, nhưng phải đảm bảo giữ khoảng cách trong sân vận động.",https://vnexpress.net/nga-gioi-han-khan-gia-vao-san-o-muc-10-4107667.html,"Thứ bảy, 30/5/2020, 09:46 (GMT+7)","Thắng Nguyễn",Nga
"La Liga trở lại vào ngày 11/6","Giải VĐQG Tây Ban Nha, La Liga mùa 2019-2020 trở lại bằng trận derby thành Seville giữa Sevilla và Betis hôm 11/6.",https://vnexpress.net/la-liga-tro-lai-vao-ngay-11-6-4107567.html,"Thứ sáu, 29/5/2020, 22:27 (GMT+7)","Nhân Đạt"
"Cựu chủ tịch Barca: 'Neymar chỉ kém tài Messi'","Cựu chủ tịch Sandro Rosell nói rằng nếu đang đương chức, ông sẽ đưa Neymar trở lại Barca bằng mọi giá.",https://vnexpress.net/cuu-chu-tich-barca-neymar-chi-kem-tai-messi-4107528.html,"Thứ sáu, 29/5/2020, 21:12 (GMT+7)","Hoàng An"
"Khúc tráng ca Sao Đỏ Belgrade","Một năm trước khi đổi thể thức và tên gọi sang Champions League, giải đấu số một châu Âu cấp CLB chứng kiến hành trình đi vào lịch sử của Red Star Belgrade.",https://vnexpress.net/khuc-trang-ca-sao-do-belgrade-4107135.html
"PSG, Inter đạt thỏa thuận vụ Icardi","Tiền đạo Mauro Icardi gần như chắc chắn sẽ ký hợp đồng dài hạn PSG từ hè này, qua đó kết thúc mối lương duyên kéo dài bảy năm với Inter.",https://vnexpress.net/psg-inter-dat-thoa-thuan-vu-icardi-4107395.html,"Thứ sáu, 29/5/2020, 16:23 (GMT+7)","Thanh Quý"
"Tyson Fury nhận lời đấu Mike Tyson","Nhà vô địch WBC thế giới Tyson Fury nhận lời đấu biểu diễn với huyền thoại Mike Tyson ngay khi được đối tác đặt vấn đề.",https://vnexpress.net/tyson-fury-nhan-loi-dau-mike-tyson-4107140.html,"Thứ sáu, 29/5/2020, 14:02 (GMT+7)","Thắng Nguyễn"
"Haaland được dự báo sẽ tới Ngoại hạng Anh","Cựu cầu thủ Na Uy, giờ là ký giả, Jan Aage Fjortoft tin tiền đạo đồng hương Erling Haaland sớm muộn gì cũng sẽ đến Anh chơi bóng.",https://vnexpress.net/haaland-duoc-du-bao-se-toi-ngoai-hang-anh-4106978.html,"Thứ sáu, 29/5/2020, 09:21 (GMT+7)","Nhân Đạt"
"Gaspart: 'Nếu Real dẫn đầu trước Covid-19, La Liga đã kết thúc'","Cựu Chủ tịch Barca Joan Gaspart ám chỉ La Liga có thể đã chọn kết thúc mùa giải và trao chức vô địch cho Real vì Covid-19, nếu Barca không hơn Real hai điểm.",https://vnexpress.net/gaspart-neu-real-dan-dau-truoc-covid-19-la-liga-da-ket-thuc-4106934.html,"Thứ sáu, 29/5/2020, 06:18 (GMT+7)","Thắng Nguyễn"
"Serie A đá lại vào ngày 20/6","Được sự cho phép của chính phủ Italy, Serie A mùa giải 2019-2020 dự kiến trở lại thi đấu từ ngày 20/6.",https://vnexpress.net/serie-a-da-lai-vao-ngay-20-6-4106964.html,"Thứ sáu, 29/5/2020, 06:15 (GMT+7)","Nhân Đạt"
"Van Gaal: 'Man Utd không mua cầu thủ tôi cần'","Cựu HLV Louis Van Gaal chỉ trích công tác chuyển nhượng kém cỏi của Man Utd khiến ông không đạt thành công như mong muốn.",https://vnexpress.net/van-gaal-man-utd-khong-mua-cau-thu-toi-can-4106940.html,"Thứ sáu, 29/5/2020, 06:13 (GMT+7)","Thanh Quý"
"PGA Tour lại huỷ sự kiện","Nằm trong lịch trình thi đấu mới, nhưng John Deere Classic vừa bị gạch tên vì Covid-19.",https://vnexpress.net/pga-tour-lai-huy-su-kien-4107326.html,"Thứ sáu, 29/5/2020, 14:42 (GMT+7)","Quốc Huy"
"European Tour tái đấu từ 22/7","Đấu trường golf nam chuyên nghiệp châu Âu - European Tour - nối lại mùa giải bằng chuỗi sáu sự kiện tại Vương quốc Anh.",https://vnexpress.net/european-tour-tai-dau-tu-22-7-4107308.html,"Thứ sáu, 29/5/2020, 14:23 (GMT+7)","Quốc Huy"
"Boston Marathon bị huỷ, chuyển sang chạy ảo","Giải chạy danh giá hàng đầu thế giới Boston Marathon lần đầu tiên bị hủy sau 124 năm, chuyển sang hình thức chạy ảo từ 7 đến 14/9 vì Covid-19.",https://vnexpress.net/boston-marathon-bi-huy-chuyen-sang-chay-ao-4107092.html,"Thứ sáu, 29/5/2020, 10:40 (GMT+7)",Phạm Vân
"Runner nhanh hơn nếu vừa cười vừa chạy","Kết quả một nghiên cứu cho thấy VĐV sẽ tiêu thụ ít oxy hơn và nhờ đó chạy nhanh hơn, nếu họ vừa cười vừa chạy.",https://vnexpress.net/runner-nhanh-hon-neu-vua-cuoi-vua-chay-4107147.html,"Thứ sáu, 29/5/2020, 10:25 (GMT+7)","Như Tâm "
"Real muốn đổi bốn cầu thủ lấy Pogba","HLV Zidane sẵn sàng đổi James, Odegaard, Vazquez và Brahim Diaz để lấy tiền vệ Paul Pogba.",https://vnexpress.net/real-muon-doi-bon-cau-thu-lay-pogba-4106949.html,"Thứ sáu, 29/5/2020, 06:22 (GMT+7)","Thanh Quý"
"Ighalo phải gia hạn với Thân Hoa Thượng Hải để ở lại Man Utd","Tiền đạo Odion Ighalo có thể ở lại Man Utd đến tháng 1/2021, nếu gia hạn hợp đồng với CLB chủ quản Thân Hoa Thượng Hải.",https://vnexpress.net/ighalo-phai-gia-han-voi-than-hoa-thuong-hai-de-o-lai-man-utd-4106959.html,"Thứ sáu, 29/5/2020, 06:19 (GMT+7)","Nhân Đạt"
"Zidane biết Champions League sẽ phải trở về với Real","Theo tiết lộ của trung vệ Sergio Ramos, HLV Zinedine Zidane đã truyền cho các học trò niềm tin lớn trước trận chung kết thắng Atletico ở Champions League 2016.",https://vnexpress.net/zidane-biet-champions-league-se-phai-tro-ve-voi-real-4107450.html,"Thứ sáu, 29/5/2020, 16:53 (GMT+7)","Duy Đoàn"
"'Người không phổi' của làng chạy Bắc Giang","Nguyễn Văn Bình (34 tuổi) nổi tiếng là chạy không biết mệt, không cần uống nước trong cả lúc luyện tập hay thi đấu. ",https://vnexpress.net/nguoi-khong-phoi-cua-lang-chay-bac-giang-4104814.html,"Thứ sáu, 29/5/2020, 14:30 (GMT+7)","Thành Dương "
"Phong cách người đẹp 'Bến Thượng Hải' ở tuổi 66","Triệu Nhã Chi, diễn viên 66 tuổi từng đóng ""Bến Thượng Hải"" của TVB, chuộng trang phục cổ điển màu pastel.",https://vnexpress.net/phong-cach-nguoi-dep-ben-thuong-hai-o-tuoi-66-4108092.html,"Chủ nhật, 31/5/2020, 15:00 (GMT+7)","Như Anh"
"Mỹ nhân '50 sắc thái' diện váy Công Trí","Dakota Johnson - nữ chính loạt phim ""50 sắc thái"" - mặc đầm ngắn thuộc bộ sưu tập Xuân Hè 2020 của Công Trí để livestream tối 29/5. ",https://vnexpress.net/my-nhan-50-sac-thai-dien-vay-cong-tri-4107995.html,"Chủ nhật, 31/5/2020, 09:08 (GMT+7)","Vân An"
"Leonardo DiCaprio kêu gọi giảm rác thải ở vịnh Lan Hạ","Tài tử Leonardo DiCaprio lo cuộc sống ngư dân ở làng chài vịnh Lan Hạ, Hải Phòng bị đe dọa vì nạn ô nhiễm môi trường, biến đổi khí hậu.",https://vnexpress.net/leonardo-dicaprio-keu-goi-giam-rac-thai-o-vinh-lan-ha-4108072.html,"Chủ nhật, 31/5/2020, 12:46 (GMT+7)","Tam Kỳ"
"Nghệ sĩ đòi công lý cho người bị cảnh sát ghì chết","Mỹ Selena Gomez, Ariana Grande... phản đối cảnh sát ghì chết người đàn ông da màu, kêu gọi fan ký tên yêu cầu điều tra vụ việc.",https://vnexpress.net/nghe-si-doi-cong-ly-cho-nguoi-bi-canh-sat-ghi-chet-4107993.html,"Chủ nhật, 31/5/2020, 10:15 (GMT+7)","Tam Kỳ",Mỹ
"Kiều Ngân diện áo dài sequin","Người mẫu Kiều Ngân mặc áo dài cách tân với voan xuyên thấu, họa tiết sequin.",https://vnexpress.net/kieu-ngan-dien-ao-dai-sequin-4107889.html,"Chủ nhật, 31/5/2020, 05:00 (GMT+7)"
"Dàn sao 'Inception' sau 10 năm","Leonardo DiCaprio duy trì vị thế tài tử hàng đầu, Tom Hardy thăng tiến, Ken Watanabe vướng scandal ngoại tình, 10 năm sau đóng ""Inception"".",https://vnexpress.net/dan-sao-inception-sau-10-nam-4106828.html,"Chủ nhật, 31/5/2020, 00:00 (GMT+7)"
"'Trolls World Tour': Thế giới âm nhạc của quỷ lùn","Sáu vương quốc của loài quỷ lùn vốn hòa thuận và yên bình, cho đến khi vương quốc nhạc Rock mở cuộc tấn công.",https://vnexpress.net/trolls-world-tour-the-gioi-am-nhac-cua-quy-lun-4107865.html,"Chủ nhật, 31/5/2020, 08:14 (GMT+7)","Phúc Nguyễn"
"Sắc vóc chân dài 25 tuổi yêu triệu phú 52 tuổi","Sharon Fonseca - người tình triệu phú Gianluca Vacchi - thu hút ánh nhìn với nhan sắc ngọt ngào và gu mặc gợi cảm. ",https://vnexpress.net/sac-voc-chan-dai-25-tuoi-yeu-trieu-phu-52-tuoi-4106635.html,"Thứ bảy, 30/5/2020, 21:00 (GMT+7)","Vân An"
"H'Hen Niê cổ vũ đua xe đạp","Đắk Lắk Hoa hậu H'Hen Niê diện trang phục thể thao cổ vũ cho chặng đua xe đạp ở quê nhà Buôn Ma Thuột, ngày 30/5.",https://vnexpress.net/h-hen-nie-co-vu-dua-xe-dap-4107848.html,"Thứ bảy, 30/5/2020, 19:27 (GMT+7)","Vân An","Đắk Lắk"
"Điệu nhảy mới của Quang Đăng hút 20 triệu lượt xem","Fanpage của WHO đăng video điệu nhảy chống hút thuốc lá của Quang Đăng, thu hút gần 20 triệu lượt xem.",https://vnexpress.net/dieu-nhay-moi-cua-quang-dang-hut-20-trieu-luot-xem-4107684.html,"Thứ bảy, 30/5/2020, 10:53 (GMT+7)","Tam Kỳ"
"Hồng Ngọc hồi phục sau tai nạn bỏng","Mỹ Hồng Ngọc cho biết cô vừa uống thuốc vừa bôi kem dưỡng thể đặc trị bỏng nên da hồi phục nhanh. ",https://vnexpress.net/hong-ngoc-hoi-phuc-sau-tai-nan-bong-4107627.html,"Thứ bảy, 30/5/2020, 08:15 (GMT+7)","Tâm Giao",Mỹ
"Kylie Jenner bị tước danh hiệu tỷ phú","Kylie Jenner bị nhiều chuyên gia kinh tế nói dùng giấy tờ giả để khai khống tài sản, nhằm đạt danh hiệu tỷ phú của tạp chí Forbes.",https://vnexpress.net/kylie-jenner-bi-tuoc-danh-hieu-ty-phu-4107603.html,"Thứ bảy, 30/5/2020, 08:03 (GMT+7)","Đạt Phan"
"Hòa Minzy, Erik nhảy điệu 'Ghen Cô Vy'","Hòa Minzy nhảy phụ họa cho Erik bài ""Ghen Cô Vy"" trong chương trình ""Music Home"", tối 29/5. ",https://vnexpress.net/hoa-minzy-erik-nhay-dieu-ghen-co-vy-4107800.html,"Thứ bảy, 30/5/2020, 19:53 (GMT+7)","Hà Thu"
"Gigi Hadid chuộng quần cạp cao khi mang bầu","Người mẫu Gigi Hadid vẫn mặc quần jean cạp cao, đeo thắt lưng khi mang thai con đầu lòng.",https://vnexpress.net/gigi-hadid-chuong-quan-cap-cao-khi-mang-bau-4107416.html,"Thứ bảy, 30/5/2020, 18:00 (GMT+7)"
"Sắc vóc sao 'Thế giới hôn nhân' tuổi 53","Kim Hee Ae, nữ chính phim ""Thế giới hôn nhân"", được nhiều khán giả khen vóc dáng khỏe khoắn, gương mặt trẻ so với tuổi 53.",https://vnexpress.net/sac-voc-sao-the-gioi-hon-nhan-tuoi-53-4107733.html,"Thứ bảy, 30/5/2020, 14:00 (GMT+7)","Như Anh"
"Váy áo thảm đỏ của Yoona","Ca sĩ kiêm diễn viên Hàn Quốc Yoona chuộng trang phục dạ hội đơn sắc, tôn dáng khi dự thảm đỏ.",https://vnexpress.net/vay-ao-tham-do-cua-yoona-4107691.html,"Thứ bảy, 30/5/2020, 12:00 (GMT+7)","Như Anh"
"Lady Gaga và Elton John đồng hành một thập kỷ","Lady Gaga kết hợp trong nhiều tiết mục, sản phẩm âm nhạc và làm mẹ đỡ đầu cho hai con trai của danh ca Elton John 10 năm qua. ",https://vnexpress.net/lady-gaga-va-elton-john-dong-hanh-mot-thap-ky-4107462.html,"Thứ bảy, 30/5/2020, 09:49 (GMT+7)","Thu Thảo"
"Dàn bạn gái của Lee Dong Gun","Lee Dong Gun từng ""phim giả tình thật"" với loạt diễn viên Ji Yeon, Han Ji Hye, Kim Min Jung...",https://vnexpress.net/dan-ban-gai-cua-lee-dong-gun-4107285.html,"Thứ bảy, 30/5/2020, 00:00 (GMT+7)","Kim Min Jung "
"Yoona đón tuổi 30","Hàng trăm nghìn fan đăng video, ảnh đẹp nhất của Yoona và chúc cô luôn xinh đẹp, khỏe mạnh khi bước vào tuổi 30.",https://vnexpress.net/yoona-don-tuoi-30-4107682.html,"Thứ bảy, 30/5/2020, 17:00 (GMT+7)","Thanh An"
"Vợ Trần Tiểu Xuân sinh con","Diễn viên Ứng Thể Nhi, vợ ""Vi Tiểu Bảo"" Trần Tiểu Xuân, sinh con trai thứ hai ngày 29/5.",https://vnexpress.net/vo-tran-tieu-xuan-sinh-con-4107642.html,"Thứ bảy, 30/5/2020, 09:23 (GMT+7)","Như Anh"
"10 đôi boots tôn phong cách mùa hè","Loạt boots phong cách cắt xẻ, đục lỗ với chất liệu cao cấp, vừa thoáng mát, vừa giúp chị em tôn cá tính hè này.",https://vnexpress.net/10-doi-boots-ton-phong-cach-mua-he-4107223.html,"Thứ bảy, 30/5/2020, 08:00 (GMT+7)","Tuệ Khương"
"Cuộc sống độc thân của Song Seung Hun","Song Seung Hun tập thể dục, nấu ăn cho bạn bè, tận hưởng cuộc sống độc thân ở tuổi 43.",https://vnexpress.net/cuoc-song-doc-than-cua-song-seung-hun-4104721.html,"Thứ sáu, 29/5/2020, 20:00 (GMT+7)","Hiểu Nhân"
"Thu Thủy có thai","Ca sĩ Thu Thủy và doanh nhân Kin Nguyễn chuẩn bị chào đón con chung sau gần một năm cưới. ",https://vnexpress.net/thu-thuy-co-thai-4107488.html,"Thứ sáu, 29/5/2020, 17:40 (GMT+7)","Vân An"
"Miranda Kerr kỷ niệm ba năm cưới tỷ phú","Siêu mẫu Miranda Kerr đăng nhiều bức ảnh chụp cùng chồng - tỷ phú Evan Spiegel - nhân kỷ niệm ba năm cưới.",https://vnexpress.net/miranda-kerr-ky-niem-ba-nam-cuoi-ty-phu-4107337.html,"Thứ sáu, 29/5/2020, 16:08 (GMT+7)","Đạt Phan"
"Bóng hồng trong đời Vua sòng bạc Macau","Lợi Trí - Hoa hậu châu Á 1986, vợ hiện tại của Lý Liên Kiệt - từng bén duyên với Vua sòng bạc Hà Hồng Sân qua khiêu vũ.",https://vnexpress.net/bong-hong-trong-doi-vua-song-bac-macau-4107067.html,"Thứ sáu, 29/5/2020, 10:12 (GMT+7)","Như Anh"
"Phan Thị Mơ dạo phố cổ","Quảng Nam Người đẹp Phan Thị Mơ mặc áo dài dạo phố cổ Hội An hôm 29/5.",https://vnexpress.net/phan-thi-mo-dao-pho-co-4107417.html,"Thứ sáu, 29/5/2020, 21:00 (GMT+7)"
"Ngô Kỳ Long: 'Tôi giỏi chăm con'","Tài tử Đài Loan Ngô Kỳ Long cho biết thành thạo chăm con, tận hưởng cuộc sống ""ông bố bỉm sữa"".",https://vnexpress.net/ngo-ky-long-toi-gioi-cham-con-4107313.html,"Thứ sáu, 29/5/2020, 18:00 (GMT+7)","Như Anh"
"Hà Kiều Anh diện vest cách điệu","Hoa hậu Hà Kiều Anh mặc vest xẻ ngực họa tiết thêu tay với chân váy midi khi dự sự kiện ngày 28/5.",https://vnexpress.net/ha-kieu-anh-dien-vest-cach-dieu-4107378.html,"Thứ sáu, 29/5/2020, 16:46 (GMT+7)"
"Cyril Kongo: Huyền thoại graffiti gốc Việt","Một bộ bếp nướng được nghệ sĩ graffiti gốc Việt Cyril Kongo ""chạm"" vào lập tức lên giá 300.000 USD. ",https://vnexpress.net/cyril-kongo-huyen-thoai-graffiti-goc-viet-4107256.html,"Thứ sáu, 29/5/2020, 15:49 (GMT+7)","Kongo là một trong những thủ lĩnh thúc đẩy phong trào graffiti. "
"Harvey Weinstein lại bị kiện tội hiếp dâm","Harvey Weinstein - đang thụ án 23 năm tù vì tội hiếp dâm - lại bị tố cáo cưỡng hiếp bốn phụ nữ.",https://vnexpress.net/harvey-weinstein-lai-bi-kien-toi-hiep-dam-4107217.html,"Thứ sáu, 29/5/2020, 13:51 (GMT+7)","Ân Nguyễn"
"Lam Trường nhập viện","TP HCM Ca sĩ Lam Trường nhập viện vì bị hạ canxi, tối 28/5.",https://vnexpress.net/lam-truong-nhap-vien-4107040.html,"Thứ sáu, 29/5/2020, 10:20 (GMT+7)","Tâm Giao","TP HCM"
"Thời trang ấn tượng của Britney Spears","Công chúa nhạc Pop Britney Spears từng diện đồ xuyên thấu, không nội y lên thảm đỏ năm 18 tuổi.",https://vnexpress.net/thoi-trang-an-tuong-cua-britney-spears-4106783.html,"Thứ sáu, 29/5/2020, 04:00 (GMT+7)","Sao Mai"
"Hà Lê ra mắt album nhạc Trịnh","Ca sĩ Hà Lê phát hành album ""Ở trọ"", gồm bảy ca khúc nhạc Trịnh được phối mới, tối 28/5. ",https://vnexpress.net/ha-le-ra-mat-album-nhac-trinh-4107274.html,"Thứ sáu, 29/5/2020, 17:52 (GMT+7)","Hà Thu"
"Thiên Khôi hát về tình yêu tuổi mới lớn","Quán quân ""Vietnam Idol Kids 2017"" - Thiên Khôi - lần đầu viết nhạc về đề tài tình yêu ở tuổi 15.",https://vnexpress.net/thien-khoi-hat-ve-tinh-yeu-tuoi-moi-lon-4107119.html,"Thứ sáu, 29/5/2020, 11:19 (GMT+7)","Tam Kỳ"
"Lady Gaga phát hành album mới","Nữ ca sĩ Lady Gaga phát hành album thứ sáu - ""Chromatica"" - hôm 29/5, sau nhiều lần trì hoãn vì dịch.",https://vnexpress.net/lady-gaga-phat-hanh-album-moi-4107146.html,"Thứ sáu, 29/5/2020, 11:11 (GMT+7)","Đạt Phan"
"Ra mắt phim Hàn về tội ác trên mạng","""Ẩn danh"" (Search Out) của đạo diễn Kwak Jung xoay quanh vụ án liên quan các dịch vụ mạng xã hội, ra rạp ngày 29/5.",https://vnexpress.net/ra-mat-phim-han-ve-toi-ac-tren-mang-4106165.html,"Thứ sáu, 29/5/2020, 10:42 (GMT+7)","Kim Ngân"
"Henry Cavill tiếp tục đóng Superman","Tài tử Henry Cavill đạt thỏa thuận mới với Warner Bros., tiếp tục vào vai Superman trong các phim của hãng.",https://vnexpress.net/henry-cavill-tiep-tuc-dong-superman-4106915.html,"Thứ sáu, 29/5/2020, 08:13 (GMT+7)","Đạt Phan"
"Rihanna sau 15 năm vào showbiz","Sau 15 năm hoạt động, Rihanna vượt Madonna trở thành nữ ca sĩ giàu nhất thế giới, với khối tài sản khoảng 600 triệu USD.",https://vnexpress.net/rihanna-sau-15-nam-vao-showbiz-4106231.html,"Thứ sáu, 29/5/2020, 00:00 (GMT+7)","Đạt Phan"
"Diễn viên 'Cô dâu vàng' kết hôn","Lee Young Ah - đóng chính phim ""Cô dâu vàng - chuẩn bị kết hôn với bạn trai kém ba tuổi.",https://vnexpress.net/dien-vien-co-dau-vang-ket-hon-4107144.html,"Thứ sáu, 29/5/2020, 10:22 (GMT+7)","Hiểu Nhân"
"Loạt túi giá hàng trăm triệu khi sang tay","Loạt túi đã qua sử dụng của Hermes, Gucci, Chanel… có giá hàng trăm triệu khi sang tay, đang bán trên chuyên trang Joolux.",https://vnexpress.net/loat-tui-gia-hang-tram-trieu-khi-sang-tay-4106778.html,"Thứ sáu, 29/5/2020, 08:00 (GMT+7)","Tuệ Khương"
"Thời trang bầu của á hậu Hoàng Oanh","Hoàng Oanh thường diện váy rộng giấu eo nhưng cũng có lúc chọn phong cách cut out, xuyên thấu khi mang thai. ",https://vnexpress.net/thoi-trang-bau-cua-a-hau-hoang-oanh-4106220.html,"Thứ năm, 28/5/2020, 21:00 (GMT+7)","Vân An"
"Lee Dong Gun ly hôn","Hai diễn viên Hàn Quốc Lee Dong Gun, Jo Yoon Hee ly hôn sau ba năm cưới.",https://vnexpress.net/lee-dong-gun-ly-hon-4106462.html,"Thứ năm, 28/5/2020, 09:07 (GMT+7)","Như Anh"
"Châu Tấn - mỹ nhân si tình","Khi yêu Lý Á Bằng, Châu Tấn nói tài tử là hình mẫu đàn ông trong mơ, mong kết hôn với anh.",https://vnexpress.net/chau-tan-my-nhan-si-tinh-4106044.html,"Thứ năm, 28/5/2020, 07:30 (GMT+7)","Như Anh"
"Tường Linh theo mốt không nội y","Á quân The Face 2017 Tường Linh diện áo lụa đơn sắc, không nội y.",https://vnexpress.net/tuong-linh-theo-mot-khong-noi-y-4106609.html,"Thứ năm, 28/5/2020, 20:20 (GMT+7)"
"Chứng khoán tuần tới có thể chinh phục 880 điểm","Xu hướng thị trường đang trở lại mức cân bằng và đi ngang nhưng chỉ số vẫn có cơ hội tăng tiếp lên vùng kháng cự 880 điểm.",https://vnexpress.net/chung-khoan-tuan-toi-co-the-chinh-phuc-880-diem-4107947.html,"Chủ nhật, 31/5/2020, 12:44 (GMT+7)","Minh Sơn"
"Chủ tịch Hoàng Quân bị chất vấn vì cổ phiếu sát đáy","Bức xúc khi giá HQC chỉ còn 1.000 đồng một cổ phiếu, cổ đông trách lãnh đạo Hoàng Quân thiếu sâu sát và lo ngại nguy cơ bị thâu tóm.",https://vnexpress.net/chu-tich-hoang-quan-bi-chat-van-vi-co-phieu-sat-day-4107921.html,"Chủ nhật, 31/5/2020, 00:46 (GMT+7)","Trung Tín"
"VAMC dự kiến thu hồi 50.000 tỷ đồng nợ xấu","Công ty Quản lý tài sản (VAMC) đặt mục tiêu năm nay xử lý 50.000 tỷ đồng dư nợ gốc và mua 5.000 tỷ đồng nợ xấu theo giá thị trường.",https://vnexpress.net/vamc-du-kien-thu-hoi-50-000-ty-dong-no-xau-4107910.html,"Chủ nhật, 31/5/2020, 08:49 (GMT+7)","Xem thêm: "
"Công ty của tỷ phú Thái phủ nhận việc bán Sabeco","ThaiBev khẳng định không có việc ""đang tìm kiếm người mua lại mảng kinh doanh ở Việt Nam"" như một số thông tin đồn đoán gần đây.",https://vnexpress.net/cong-ty-cua-ty-phu-thai-phu-nhan-viec-ban-sabeco-4107803.html,"Thứ bảy, 30/5/2020, 17:15 (GMT+7)","Minh Sơn"
"Soya Garden - từ tham vọng chuỗi lớn tới mô hình ki-ốt","Từ thương vụ đầu tư thành công nhất của Shark Tank Việt Nam hai mùa đầu, Soya Garden đang phải đóng nhiều cửa hàng lớn để chuyển sang mô hình ki-ốt.",https://vnexpress.net/soya-garden-tu-tham-vong-chuoi-lon-toi-mo-hinh-ki-ot-4107598.html,"Thứ bảy, 30/5/2020, 14:47 (GMT+7)","'Chỉ chuyển đổi mô hình kinh doanh'"
"Dầu thô Mỹ chốt tháng tăng 88%","""Vàng đen"" xác lập tháng tăng cao nhất trong lịch sử nhờ những biện pháp cắt giảm sản xuất mạnh tay và nhu cầu phục hồi sau giai đoạn giãn cách.",https://vnexpress.net/dau-tho-my-chot-thang-tang-88-4107738.html,"Thứ bảy, 30/5/2020, 12:30 (GMT+7)","Minh Sơn"
"Sóng ngầm các đại đô thị đổ về cực Đông Sài Gòn","TP HCMĐề án lập thành phố phía Đông có thể tạo nên làn sóng các dự án nhà ở quy mô lớn dịch chuyển về tâm điểm mới này.",https://vnexpress.net/song-ngam-cac-dai-do-thi-do-ve-cuc-dong-sai-gon-4107591.html,"Thứ bảy, 30/5/2020, 10:42 (GMT+7)","Trung Tín","TP HCM"
"Tôm hùm tăng giá trở lại","Khi nhà hàng, quán ăn hoạt động nhộn nhịp sau thời gian giãn cách xã hội, mỗi kg tôm hùm bông tăng lên 1,2-1,5 triệu đồng.",https://vnexpress.net/tom-hum-tang-gia-tro-lai-4107319.html,"Thứ bảy, 30/5/2020, 07:06 (GMT+7)","Thi Hà"
"Ông Trịnh Văn Quyết bán tiếp 28 triệu cổ phiếu ROS","Giao dịch thoái 28,2 triệu cổ phiếu vừa được ông Trịnh Văn Quyết thực hiện mới đây với lý do ""giảm tỷ lệ sở hữu tại công ty"".",https://vnexpress.net/ong-trinh-van-quyet-ban-tiep-28-trieu-co-phieu-ros-4107601.html,"Thứ bảy, 30/5/2020, 06:26 (GMT+7)","Phương Đông"
"Duyệt quy hoạch siêu đô thị 600.000 dân ở Hòa Lạc","Hà NộiThủ tướng vừa phê duyệt quy hoạch Hoà Lạc thành đô thị khoa học công nghệ với dự kiến năm 2030, đáp ứng nhà ở cho 600.000 dân.",https://vnexpress.net/duyet-quy-hoach-sieu-do-thi-600-000-dan-o-hoa-lac-4107625.html,"Thứ bảy, 30/5/2020, 07:21 (GMT+7)","Phân khu","Hà Nội"
"Rao bán cả ngôi làng giá hơn 7 triệu USD","Thụy ĐiểnMột ngôi làng cổ 300 tuổi, rộng 25 hecta, có suối khoáng dùng làm nơi trị liệu, nghỉ dưỡng đang tìm chủ nhân mới.",https://vnexpress.net/rao-ban-ca-ngoi-lang-gia-hon-7-trieu-usd-4106958.html,"Thứ bảy, 30/5/2020, 00:17 (GMT+7)"
"Phố Wall phục hồi nhờ Trump nói 'giữ cam kết với Trung Quốc'","Cam kết không thay đổi thỏa thuận thương mại giai đoạn một với Trung Quốc của Trump giúp chứng khoán Mỹ tăng trở lại cuối phiên 29/5.",https://vnexpress.net/pho-wall-phuc-hoi-nho-trump-noi-giu-cam-ket-voi-trung-quoc-4107621.html,"Thứ bảy, 30/5/2020, 07:30 (GMT+7)","Minh Sơn"
"Novaland đẩy mạnh kế hoạch phân phối sản phẩm","Novaland cùng hàng chục đơn vị phân phối bất động sản do tập đoàn này phát triển nhằm phục vụ nhu cầu sở hữu, đầu tư ngày càng cao của khách hàng.",https://vnexpress.net/novaland-day-manh-ke-hoach-phan-phoi-san-pham-4107856.html,"Thứ bảy, 30/5/2020, 19:00 (GMT+7)","Nam Anh"
"Mẹ bán hàng online nuôi ba con học trường quốc tế","Bán hàng online trên Lazada giúp Đoàn Trần Thùy Linh chủ động kinh tế, từ đó truyền lửa kinh doanh cho những phụ nữ khác trên nền tảng thương mại điện tử.",https://vnexpress.net/me-ban-hang-online-nuoi-ba-con-hoc-truong-quoc-te-4105519.html,"Thứ bảy, 30/5/2020, 11:00 (GMT+7)","Chuyển hướng kinh doanh, vượt Covid-19 thành công"
"Nhiều doanh nghiệp dự báo giảm doanh thu do Covid-19","Đa số doanh nghiệp dự báo doanh thu giảm do ảnh hưởng dịch bệnh và hướng đến giải pháp cắt giảm ngân sách nhân sự, theo khảo sát của Talentnet. ",https://vnexpress.net/nhieu-doanh-nghiep-du-bao-giam-doanh-thu-do-covid-19-4106801.html,"Thứ bảy, 30/5/2020, 08:00 (GMT+7)","Trang Anh"
